"DESCRIPTION","DURATION IN MS","NAME","PARENT SUITE","START TIME","STATUS","STOP TIME","SUB SUITE","SUITE","TEST CLASS","TEST METHOD"
"This test attempts to retrieve user information with an expired token.","95","WhoAmI with expired token","chromium","Fri Jan 17 11:48:30 PST 2025","failed","Fri Jan 17 11:48:31 PST 2025","API Testing - WhoAmI","TPay V3 Api Testing\Api_Auth_test.spec.ts","",""
"This test retrieves the current user information using the WhoAmI endpoint.","159","WhoAmI","chromium","Fri Jan 17 11:48:28 PST 2025","passed","Fri Jan 17 11:48:29 PST 2025","API Testing - WhoAmI","TPay V3 Api Testing\Api_Auth_test.spec.ts","",""
"This test attempts to retrieve user information with an invalid token.","1257","WhoAmI with invalid token","chromium","Fri Jan 17 11:48:29 PST 2025","failed","Fri Jan 17 11:48:30 PST 2025","API Testing - WhoAmI","TPay V3 Api Testing\Api_Auth_test.spec.ts","",""
"This test logs in a user and stores the tokens in environment variables.","397","Login","chromium","Fri Jan 17 11:48:24 PST 2025","passed","Fri Jan 17 11:48:24 PST 2025","API Testing - Login","TPay V3 Api Testing\Api_Auth_test.spec.ts","",""
"This test runs the WhoAmI endpoint multiple times to calculate the average response time.","23982","WhoAmI multiple times","chromium","Fri Jan 17 11:48:31 PST 2025","passed","Fri Jan 17 11:48:55 PST 2025","API Testing - WhoAmI","TPay V3 Api Testing\Api_Auth_test.spec.ts","",""
